{
  "schemaVersion": 1,
  "configVersion": "2026-10-05.1",
  "refreshIntervalSeconds": 3600,
  "app": {
    "minimumSupportedVersion": 1,
    "latestVersion": 1,
    "forceUpdate": false,
    "updateUrl": "https://daricheh.example/download2",
    "message": {
      "en": "This version is no longer supported. Update to keep using your services.",
      "fa": "این نسخه دیگر پشتیبانی نمی‌شود. برای ادامه استفاده، برنامه را به‌روز کنید."
    },
    "optionalMessage": {
      "en": "A new version with faster switching between services is ready.",
      "fa": "نسخه جدید با جابه‌جایی سریع‌تر بین سرویس‌ها آماده است."
    },
    "channels": {
      "bazaar": {
        "minimumSupportedVersion": 1,
        "latestVersion": 1
      },
      "myket": {
        "minimumSupportedVersion": 1,
        "latestVersion": 1
      }
    }
  },
  "features": {
    "search": true,
    "favorites": true,
    "multiProfile": true,
    "compareMode": true,
    "downloads": true,
    "storageManager": true
  },
  "web": {
    "paymentDomains": [
      "shaparak.ir",
      "sep.ir",
      "sadadpsp.ir",
      "pec.ir",
      "pep.co.ir",
      "asanpardakht.ir",
      "ap.ir",
      "irankish.com",
      "zarinpal.com",
      "payping.ir",
      "idpay.ir",
      "zibal.ir",
      "nextpay.org",
      "vandar.io",
      "jibit.ir",
      "bitpay.ir",
      "pay.ir",
      "digipay.ir",
      "mydigipay.com"
    ],
    "externalSchemes": [
      "tel",
      "mailto",
      "sms",
      "smsto",
      "geo",
      "market",
      "bazaar",
      "myket",
      "intent",
      "tg",
      "whatsapp"
    ]
  },
  "links": {
    "privacyPolicyUrl": "https://daricheh.example/privacy",
    "supportUrl": "https://daricheh.example/support"
  },
  "categories": [
    {
      "id": "transport",
      "title": {
        "en": "Transportation",
        "fa": "حمل‌ونقل"
      },
      "icon": "icons/categories/transport.png",
      "color": "#2F9E44",
      "order": 1,
      "enabled": true
    },
    {
      "id": "food",
      "title": {
        "en": "Food",
        "fa": "غذا"
      },
      "icon": "icons/categories/food.png",
      "color": "#E8590C",
      "order": 2,
      "enabled": true
    },
    {
      "id": "shopping",
      "title": {
        "en": "Shopping",
        "fa": "خرید"
      },
      "icon": "icons/categories/shopping.png",
      "color": "#D6336C",
      "order": 3,
      "enabled": true
    },
    {
      "id": "classifieds",
      "title": {
        "en": "Classifieds",
        "fa": "نیازمندی‌ها"
      },
      "icon": "icons/categories/classifieds.png",
      "color": "#7048E8",
      "order": 4,
      "enabled": true
    },
    {
      "id": "travel",
      "title": {
        "en": "Travel",
        "fa": "سفر"
      },
      "icon": "icons/categories/travel.png",
      "color": "#1C7ED6",
      "order": 5,
      "enabled": true
    },
    {
      "id": "maps",
      "title": {
        "en": "Maps",
        "fa": "نقشه و مسیریابی"
      },
      "icon": "icons/categories/maps.png",
      "color": "#0CA678",
      "order": 6,
      "enabled": true
    },
    {
      "id": "entertainment",
      "title": {
        "en": "Entertainment",
        "fa": "سرگرمی"
      },
      "icon": "icons/categories/entertainment.png",
      "color": "#AE3EC9",
      "order": 7,
      "enabled": true
    },
    {
      "id": "health",
      "title": {
        "en": "Health",
        "fa": "سلامت"
      },
      "icon": "icons/categories/health.png",
      "color": "#F03E3E",
      "order": 8,
      "enabled": true
    },
    {
      "id": "finance",
      "title": {
        "en": "Finance",
        "fa": "مالی"
      },
      "icon": "icons/categories/finance.png",
      "color": "#1098AD",
      "order": 9,
      "enabled": true
    },
    {
      "id": "utilities",
      "title": {
        "en": "Telecom & bills",
        "fa": "اپراتور و قبوض"
      },
      "icon": "icons/categories/utilities.png",
      "color": "#4C6EF5",
      "order": 10,
      "enabled": true
    },
    {
      "id": "government",
      "title": {
        "en": "Government",
        "fa": "خدمات دولتی"
      },
      "icon": "icons/categories/government.png",
      "color": "#495057",
      "order": 11,
      "enabled": true
    },
    {
      "id": "messaging",
      "title": {
        "en": "Messaging",
        "fa": "پیام‌رسان"
      },
      "icon": "icons/categories/messaging.png",
      "color": "#15AABF",
      "order": 12,
      "enabled": true
    }
  ],
  "services": [
    {
      "id": "snapp",
      "name": {
        "en": "Snapp",
        "fa": "اسنپ"
      },
      "description": {
        "en": "Cars, bikes and couriers on demand",
        "fa": "درخواست خودرو، موتور و پیک"
      },
      "categoryId": "transport",
      "url": "https://app.snapp.taxi/",
      "logo": "logos/snapp.png",
      "brandColor": "#00D170",
      "enabled": true,
      "order": 10,
      "featured": true,
      "compatibility": "SUPPORTED",
      "web": {
        "allowedDomains": [
          "snapp.taxi",
          "snapp.ir"
        ],
        "javascript": true,
        "domStorage": true,
        "permissions": {
          "location": true,
          "camera": false,
          "microphone": false
        },
        "fileUpload": true,
        "downloads": true,
        "popupPolicy": "NEW_TAB",
        "offDomainNavigation": "STAY_IN_TAB",
        "thirdPartyCookies": true,
        "cacheMode": "DEFAULT",
        "keepAlive": "HIGH",
        "restoreLastUrl": true
      },
      "keywords": [
        "snap",
        "taxi",
        "ride",
        "تاکسی",
        "تاکسی اینترنتی",
        "ماشین"
      ]
    },
    {
      "id": "tapsi",
      "name": {
        "en": "Tapsi",
        "fa": "تپسی"
      },
      "description": {
        "en": "Ride hailing across Iran",
        "fa": "تاکسی اینترنتی در سراسر ایران"
      },
      "categoryId": "transport",
      "url": "https://app.tapsi.cab/",
      "logo": "logos/tapsi.png",
      "brandColor": "#FF6A00",
      "enabled": true,
      "order": 20,
      "featured": true,
      "compatibility": "SUPPORTED",
      "web": {
        "allowedDomains": [
          "tapsi.cab",
          "tapsi.ir"
        ],
        "javascript": true,
        "domStorage": true,
        "permissions": {
          "location": true,
          "camera": false,
          "microphone": false
        },
        "fileUpload": true,
        "downloads": true,
        "popupPolicy": "NEW_TAB",
        "offDomainNavigation": "STAY_IN_TAB",
        "thirdPartyCookies": true,
        "cacheMode": "DEFAULT",
        "keepAlive": "HIGH",
        "restoreLastUrl": true
      },
      "keywords": [
        "tap30",
        "taxi",
        "ride",
        "تاکسی",
        "تپ سی"
      ]
    },
    {
      "id": "snappbox",
      "name": {
        "en": "Snapp Box",
        "fa": "اسنپ‌باکس"
      },
      "description": {
        "en": "Parcel delivery",
        "fa": "ارسال مرسوله"
      },
      "categoryId": "transport",
      "url": "https://app.snapp-box.com/",
      "logo": "logos/snappbox.png",
      "brandColor": "#00B862",
      "enabled": false,
      "order": 30,
      "featured": false,
      "compatibility": "SUPPORTED",
      "web": {
        "allowedDomains": [
          "snapp-box.com"
        ],
        "javascript": true,
        "domStorage": true,
        "permissions": {
          "location": true,
          "camera": false,
          "microphone": false
        },
        "fileUpload": true,
        "downloads": true,
        "popupPolicy": "NEW_TAB",
        "offDomainNavigation": "STAY_IN_TAB",
        "thirdPartyCookies": true,
        "cacheMode": "DEFAULT",
        "keepAlive": "NORMAL",
        "restoreLastUrl": true
      }
    },
    {
      "id": "snappfood",
      "name": {
        "en": "SnappFood",
        "fa": "اسنپ‌فود"
      },
      "description": {
        "en": "Restaurants and groceries delivered",
        "fa": "سفارش غذا و سوپرمارکت"
      },
      "categoryId": "food",
      "url": "https://snappfood.ir/",
      "logo": "logos/snappfood.png",
      "brandColor": "#FF00A6",
      "enabled": true,
      "order": 40,
      "featured": true,
      "compatibility": "SUPPORTED",
      "web": {
        "allowedDomains": [
          "snappfood.ir"
        ],
        "javascript": true,
        "domStorage": true,
        "permissions": {
          "location": true,
          "camera": false,
          "microphone": false
        },
        "fileUpload": true,
        "downloads": true,
        "popupPolicy": "NEW_TAB",
        "offDomainNavigation": "STAY_IN_TAB",
        "thirdPartyCookies": true,
        "cacheMode": "DEFAULT",
        "keepAlive": "NORMAL",
        "restoreLastUrl": true
      },
      "keywords": [
        "food",
        "restaurant",
        "delivery",
        "رستوران",
        "غذا",
        "زودفود"
      ]
    },
    {
      "id": "tapsifood",
      "name": {
        "en": "Tapsi Food",
        "fa": "تپسی‌فود"
      },
      "description": {
        "en": "Food delivery from nearby restaurants",
        "fa": "سفارش غذا از رستوران‌های نزدیک"
      },
      "categoryId": "food",
      "url": "https://tapsi.food/",
      "logo": "logos/tapsifood.png",
      "brandColor": "#FF6A00",
      "enabled": true,
      "order": 50,
      "featured": false,
      "compatibility": "SUPPORTED",
      "web": {
        "allowedDomains": [
          "tapsi.food"
        ],
        "javascript": true,
        "domStorage": true,
        "permissions": {
          "location": true,
          "camera": false,
          "microphone": false
        },
        "fileUpload": true,
        "downloads": true,
        "popupPolicy": "NEW_TAB",
        "offDomainNavigation": "STAY_IN_TAB",
        "thirdPartyCookies": true,
        "cacheMode": "DEFAULT",
        "keepAlive": "NORMAL",
        "restoreLastUrl": true
      },
      "keywords": [
        "food",
        "رستوران",
        "غذا"
      ]
    },
    {